{
  "schema": "agentic-os.upskill.result/v1",
  "capability": "agentic-os.upskill",
  "status": "blocked",
  "readiness": {
    "career": {
      "status": "blocked",
      "observed_at": "2026-07-23T12:00:00Z",
      "capabilities": [],
      "reasons": ["configured Career System root is unavailable"]
    },
    "knowledge": {
      "status": "ready",
      "observed_at": "2026-07-23T12:00:00Z",
      "capabilities": ["knowledge.project.snapshot/v1"],
      "reasons": []
    },
    "mastery": {
      "status": "ready",
      "observed_at": "2026-07-23T12:00:00Z",
      "capabilities": ["mastery.cycles.snapshot"],
      "reasons": []
    }
  },
  "snapshot_acquisition": "not_started",
  "snapshots": {},
  "ranking": [],
  "mappings": [],
  "writes": 0,
  "verification": {
    "code": "not_run",
    "message": "Full-graph verification did not run because readiness blocked snapshot acquisition."
  },
  "blocked_actions": [
    {
      "code": "career_readiness_blocked",
      "message": "agentic-os.upskill cannot acquire Career Requisite data until Career readiness succeeds."
    }
  ]
}
